25.45,7,42,Triangle Glass Terrarium,Fam unicorn sustainable. Tattooed asymmetrical glossier butcher mumblecore whatever aesthetic beard. Chia distillery aesthetic viral direct trade man bun. Poke literally kitsch hashtag enamel pin. Direct trade biodiesel kombucha mixtape. Hell of poke microdosing chartreuse sustainable, XOXO gluten-free meh succulents hot chicken paleo vinyl.,Dimensions: 5" x 4",planter1.jpg,planters
18.20,21,80,Geometric Wooden Planter,Solid wood planter that has been hand painted white and sealed with a wood protection spray. Designed for succulents. Dimensions: 4" x 3.5",planter3.jpg,planters
12.40,15,54,Mini Geo Planter,This planter has beed crafted out of reclaimed wood and darkened with a chestnut stain. It has been hand painted seafoam green on one side. Designed for air plants. Dimensions: 2" x 2" x 2",planter4.jpg,planters
32.40.93,4,9,Mini Ceramic Planter Trio,This planter set has been 3D printed from ceramic materials and is the perfect decoration for your window sil. Each planter has a drainage hole. Dimensions: 3" x 2",planter5.jpg,planters
25.30,17,58,Cat Ceramic Pottery Planter,This hand crafted sleepy cat ceramic planter has been glazed inside out with a mint green and sliver blue glaze. Dimensions: 5" x 3.25",planter6.jpg,planters
38.74,13,78,Ronald Ward,Happy Clay Planter Set, This set includes three planters made from high quality ceramic and hand painted pink, yellow, or green. They are perfect for brightening your desk. Dimensions: 3" x 3.75",planter7.jpg,planters
9.50,20,66,Concrete Orb Planter,Each orb planter is handmade and unique, made of concrete and ceramic gold paint. They are great for succulents and air plants. Dimensions: 5" x 4",planter8.jpg,planters
13.81,19,96,Henry Watson,Extended value-added arrayDimensions: 3" x 3.75",planter9.jpg,planters
